{
  "event_type": "cpx_exposure",
  "serve_token": "stk_3pQabcdef",
  "session_id": "s_9k3",
  "platform_id": "pf_123",
  "agent_id": "ag_456",
  "wallet_id": "w_456",
  "pricing": { "unit": "CPX", "amount": "0.034", "currency": "USD" },
  "exposure_metadata": { "surface": "text", "position": 1, "visibility_ms": 1800 },
  "ts": "2025-11-11T13:17:14Z",
  "auth": { "nonce": "n_e12", "sig": "sig101" }
}
